username,caption
user1,Having a great day at the beach!
user2,Data Science is amazing.
user3,Feeling sad today. :(
user4,Love my new phone!
user5,The weather is terrible!
user6,This cake is delicious!
user7,Enjoying the little things in life.
user8,Stuck in traffic again. :(
user9,I love coding!
user10,Can't wait for the weekend.
user11,Best day ever!
user12,Mondays are so dull.
user13,Just got a promotion! #blessed
user14,I'm so bored.
user15,Date night! <3
user16,Trying out a new recipe!
user17,Just finished a great book.
user18,This movie is a waste of time.
user19,Hiking is the best exercise.
user20,Feeling really sick today.
user21,Coffee is life.
user22,Feeling blessed.
user23,Grateful for my family.
user24,It's too hot outside!
user25,Is it Friday yet?
user26,Nature is beautiful.
user27,I don't like this restaurant.
user28,Just graduated! #Success
user29,This new album is fire!
user30,Can't sleep.
user31,This game is awesome!
user32,I hate my job.
user33,Just got back from a great vacation.
user34,My cat is the cutest.
user35,Feeling lonely.
user36,Just ran my first marathon!
user37,I can't believe this happened.
user38,This pizza is amazing!
user39,Feeling stressed about exams.
user40,Love spending time with friends.
user41,Cooking is so therapeutic.
user42,Can't stand this heat!
user43,Going on a shopping spree!
user44,Feeling down today.
user45,Just got a haircut and I love it!
user46,Life is tough.
user47,This show is so funny!
user48,Dinner was disappointing.
user49,Happy to be home.
user50,I love my dog.